{
  "$schema": "https://json-schema.org/draft/2020-12/schema",
  "$id": "https://theorem-governance.github.io/release-trust-root.schema.json",
  "title": "Theorem Release Trust Root",
  "type": "object",
  "additionalProperties": false,
  "required": ["schema_version", "generated_at", "root_keys", "roles"],
  "properties": {
    "schema_version": { "type": "string" },
    "generated_at": { "type": "string" },
    "root_keys": {
      "type": "array",
      "minItems": 1,
      "items": {
        "type": "object",
        "additionalProperties": false,
        "required": ["key_id", "algorithm", "public_key_hex", "status"],
        "properties": {
          "key_id": { "type": "string" },
          "algorithm": {
            "type": "string",
            "enum": ["ed25519"]
          },
          "public_key_hex": { "type": "string", "pattern": "^[0-9a-f]{64}$" },
          "status": {
            "type": "string",
            "enum": ["active", "revoked", "retired"]
          }
        }
      }
    },
    "roles": {
      "type": "array",
      "minItems": 1,
      "items": {
        "type": "object",
        "additionalProperties": false,
        "required": ["name", "threshold", "key_ids"],
        "properties": {
          "name": { "type": "string" },
          "threshold": { "type": "integer", "minimum": 1 },
          "key_ids": {
            "type": "array",
            "minItems": 1,
            "items": { "type": "string" }
          }
        }
      }
    }
  }
}
